{
  "$schema": "https://json-schema.org/draft/2020-12/schema",
  "$id": "https://schemas.dholbeat.local/v1/workflow-source.schema.json",
  "title": "Workflow source contract version 1",
  "type": "object",
  "additionalProperties": false,
  "required": [
    "schema_version",
    "workflow_id",
    "project_id",
    "brand_id",
    "owner",
    "stage",
    "trigger",
    "timeout_seconds",
    "input_schema_id",
    "output_schema_id",
    "revision_key_template",
    "idempotency_key_template",
    "retention",
    "nodes"
  ],
  "properties": {
    "schema_version": {"const": 1},
    "workflow_id": {"type": "string", "pattern": "^[a-z][a-z0-9]*(?:-[a-z0-9]+)*$"},
    "project_id": {"type": "string", "pattern": "^[a-z][a-z0-9]*(?:-[a-z0-9]+)*$"},
    "brand_id": {"type": "string", "pattern": "^[a-z][a-z0-9]*(?:-[a-z0-9]+)*$"},
    "owner": {"type": "string", "minLength": 1},
    "stage": {"enum": ["research", "ideation", "drafting", "approval", "publishing", "metrics"]},
    "trigger": {"enum": ["manual", "webhook", "schedule", "event"]},
    "timeout_seconds": {"type": "integer", "minimum": 1, "maximum": 1200},
    "input_schema_id": {"type": "string", "pattern": "^[a-z][a-z0-9-]*(?:-[a-z0-9]+)*$"},
    "output_schema_id": {"type": "string", "pattern": "^[a-z][a-z0-9-]*(?:-[a-z0-9]+)*$"},
    "revision_key_template": {"const": "project/{project_id}/brand/{brand_id}/content/{content_id}/revision/{revision}"},
    "idempotency_key_template": {"const": "project/{project_id}/brand/{brand_id}/content/{content_id}/revision/{revision}/{channel}/{scheduled_at}"},
    "retention": {
      "type": "object",
      "additionalProperties": false,
      "required": ["success_days", "failure_days", "owner"],
      "properties": {
        "success_days": {"type": "integer", "minimum": 0},
        "failure_days": {"type": "integer", "minimum": 1},
        "owner": {"type": "string", "minLength": 1}
      }
    },
    "nodes": {
      "type": "array",
      "minItems": 1,
      "items": {
        "type": "object",
        "additionalProperties": false,
        "required": ["id", "type", "parameters"],
        "properties": {
          "id": {"type": "string", "minLength": 1},
          "type": {"type": "string", "minLength": 1},
          "parameters": {"type": "object"}
        }
      }
    }
  }
}
